{
  "schema_version": "1.0",
  "paper_id": "ELIS-PAPER-01",
  "generated_at": "2026-08-08T11:00:00Z",
  "method_version": "v0.6.1",
  "implementation_plan_version": "v1.0",
  "source_documents": [
    "ELIS_Paper1_ELIS_SLR_Agent_Adaptation_Implementation_Plan_v1.0_2026-08-07.md",
    "P1-DEC-001 through P1-DEC-011 (all 11 durable Paper 1 decision records); Phase 0\u20133 authorisation recorded as milestone P1-M02",
    "P1-M02-execution-plan-approved.md",
    "STATUS.md"
  ],
  "governance_note": "NOT OPERATIVE — H1 human approval required before this Proposition Register governs any downstream work. All propositions are current per method v0.6.1 but subject to H1 review.",
  "essential_steps": [
    {
      "step_id": "ES-01",
      "name": "Proposition Register Definition & H1 Gate",
      "phase": "Phase 1",
      "workflow_order": 1,
      "description": "Define the canonical proposition register, create supporting schemas, and obtain PO/researcher H1 approval before any search execution begins.",
      "human_gate": "H1",
      "blocks_downstream": true
    },
    {
      "step_id": "ES-02",
      "name": "Protocol & Schema Package",
      "phase": "Phase 1",
      "workflow_order": 2,
      "description": "Create and validate all 8 JSON Schemas, source-families.yaml, query-families.yaml, and model-registry.yaml. Validated by consolidated JSON Schema Validation Canary.",
      "blocks_downstream": true
    },
    {
      "step_id": "ES-03",
      "name": "S0 Systematic Deterministic Search",
      "phase": "Phase 2/3",
      "workflow_order": 3,
      "description": "Execute deterministic systematic search from approved Proposition Register, source families, query families, temporal/language scope, and stopping rule. Produce search-log, candidate-artifacts, failed-candidates, source-coverage, and stopping-rule-attestation.",
      "blocks_downstream": false
    },
    {
      "step_id": "ES-04",
      "name": "S1 Kimi Independent AI Discovery",
      "phase": "Phase 2/3",
      "workflow_order": 4,
      "description": "Execute independent AI-assisted discovery via Kimi K2.6 from identical versioned input package. Derive own queries. Produce sealed output with completion-attestation and SHA256SUMS.",
      "blocks_downstream": false
    },
    {
      "step_id": "ES-05",
      "name": "S2 DeepSeek Independent AI Discovery",
      "phase": "Phase 2/3",
      "workflow_order": 5,
      "description": "Execute independent AI-assisted discovery via DeepSeek V4 Pro (elis-supervisor) from identical versioned input package, under 5-point boundary restriction. Produce sealed output with completion-attestation and SHA256SUMS.",
      "blocks_downstream": false
    },
    {
      "step_id": "ES-06",
      "name": "Sealed Lane Release & Candidate Union",
      "phase": "Phase 2/3",
      "workflow_order": 6,
      "description": "Verify all three lane completion attestations. Release sealed directories. Deterministically union candidates, preserving DISCOVERY_ROUTE attribution for every candidate.",
      "blocks_downstream": true
    },
    {
      "step_id": "ES-07",
      "name": "Screening",
      "phase": "Phase 3/4",
      "workflow_order": 7,
      "description": "Determine artifact eligibility only. Must not assign PESC values. Preserve exclusions with reasons.",
      "blocks_downstream": false
    },
    {
      "step_id": "ES-08",
      "name": "Extraction",
      "phase": "Phase 3/4",
      "workflow_order": 8,
      "description": "Build structured evidence packets from screened artifacts. Validate against actual artifact metadata and verbatim excerpts. AI suggestions must be labelled non-operative.",
      "blocks_downstream": false
    },
    {
      "step_id": "ES-09",
      "name": "H2 Human Artifact Admission",
      "phase": "Phase 4",
      "workflow_order": 9,
      "description": "PO/researcher confirms artifact existence, identity, provenance, boundary, and proposition linkage. Blocks Evidence Register admission and all downstream coding/challenge tasks.",
      "human_gate": "H2",
      "blocks_downstream": true
    },
    {
      "step_id": "ES-10",
      "name": "H3 Human PESC Coding",
      "phase": "Phase 4",
      "workflow_order": 10,
      "description": "PO/researcher assigns TYPE, PUB, DUR, AUT values to admitted artifacts. AI suggestions must be labelled non-operative and cannot populate human code fields.",
      "human_gate": "H3",
      "blocks_downstream": true
    },
    {
      "step_id": "ES-11",
      "name": "Targeted AI Challenge",
      "phase": "Phase 4",
      "workflow_order": 11,
      "description": "AI challenges human PESC codes for consistency, contradiction, and completeness. Challenge outputs labelled non-operative. Does not override human codes.",
      "blocks_downstream": false
    },
    {
      "step_id": "ES-12",
      "name": "H4 Final Interpretation",
      "phase": "Phase 4",
      "workflow_order": 12,
      "description": "PO/researcher approves proposition scores, step profiles, thresholds, and claims before manuscript integration.",
      "human_gate": "H4",
      "blocks_downstream": true
    },
    {
      "step_id": "ES-13",
      "name": "Integration & Traceability Audit",
      "phase": "Phase 4/5",
      "workflow_order": 13,
      "description": "Integrate only validated and human-approved outputs. Enforce full traceability chain: manuscript claim → result → proposition → artifact → source.",
      "blocks_downstream": false
    }
  ],
  "propositions": [
    {
      "proposition_id": "P1-P-0001",
      "title": "P1-ART Governance Independence",
      "proposition_text": "P1-ART (electoral evidence artifact discovery) is governed exclusively by Paper 1's own validated methodology and is NOT governed by the ELIS SLR Protocol or PRISMA guidelines.",
      "essential_step_id": "ES-01",
      "applicability": "P1-ART",
      "rationale": "Paper 1's PESC methodology, three-lane discovery, and proposition-level aggregation have no PRISMA analogue. Conflating governance domains would apply incorrect validation standards.",
      "TEST_STATEMENT": "A review of all P1-ART workflow documentation, task descriptions, and agent instructions SHALL find zero references to PRISMA compliance requirements for P1-ART tasks, and every P1-ART governance reference SHALL cite Paper 1 methodology v0.6.1 as its sole authority.",
      "expected_evidence_scope": "All P1-ART workflow documentation, Kanban task bodies, and agent SOUL.md/AGENTS.md files — approximately 10-20 documents.",
      "source_decision_ids": [
        "P1-DEC-001"
      ]
    },
    {
      "proposition_id": "P1-P-0002",
      "title": "P1-LIT Protocol Governance",
      "proposition_text": "P1-LIT (literature review evidence map) is governed by the ELIS SLR Protocol and follows PRISMA-style discipline for literature discovery, screening, extraction, and synthesis.",
      "essential_step_id": "ES-01",
      "applicability": "P1-LIT",
      "rationale": "The literature review component is a standard systematic review workflow and should follow established protocol discipline to ensure reproducibility and completeness.",
      "TEST_STATEMENT": "A review of all P1-LIT workflow documentation, task descriptions, and agent instructions SHALL find PRISMA-style discipline requirements (search strategy documentation, inclusion/exclusion criteria, screening procedure, extraction protocol) for every P1-LIT step.",
      "expected_evidence_scope": "All P1-LIT workflow documentation, screening logs, extraction protocols — approximately 8-15 documents.",
      "source_decision_ids": [
        "P1-DEC-001"
      ]
    },
    {
      "proposition_id": "P1-P-0003",
      "title": "PESC Four-Field Reduction",
      "proposition_text": "PESC coding uses exactly four fields — TYPE, PUB, DUR, AUT — reduced from the original v0.6 field set, with DUR and AUT treated as independent dimensions.",
      "essential_step_id": "ES-02",
      "applicability": "P1-ART",
      "rationale": "Complexity was the #1 reviewer-identified risk. Reducing to four core fields eliminates coding burden without losing analytical power for Paper 1's research questions. DUR/AUT independence prevents conflation of temporal and authority dimensions.",
      "TEST_STATEMENT": "The PESC code schema (pesc-code.schema.json) SHALL define exactly four code fields — TYPE, PUB, DUR, AUT — and no others. Any instance of PESC coding output SHALL populate only these four fields.",
      "expected_evidence_scope": "pesc-code.schema.json, coding/human/pesc-codes.json, all PESC coding instructions — approximately 5-8 artifacts.",
      "source_decision_ids": [
        "P1-DEC-002"
      ]
    },
    {
      "proposition_id": "P1-P-0004",
      "title": "Deterministic V Derivation",
      "proposition_text": "Evidence value (V) is derived deterministically from PESC field combinations via predefined rules, not via AI judgement or model inference.",
      "essential_step_id": "ES-02",
      "applicability": "P1-ART",
      "rationale": "AI-based V derivation introduces non-determinism and reproducibility risk. Deterministic rules ensure the same PESC codes always produce the same V, eliminating AI coding variance from the evidence-value layer.",
      "TEST_STATEMENT": "For any set of PESC field values, the V derivation SHALL produce the identical result regardless of which agent or run performs the derivation, and the derivation rules SHALL be expressed as a finite, enumerable function of the four PESC fields.",
      "expected_evidence_scope": "V derivation rules document, evidence packet outputs with PESC codes and derived V values — approximately 10-50 evidence packets.",
      "source_decision_ids": [
        "P1-DEC-002"
      ]
    },
    {
      "proposition_id": "P1-P-0005",
      "title": "Proposition-Level Single-Pass Aggregation",